{
  "ir_version": "1.0",
  "compiler_version": "1.1",
  "artifact_type": "dependency_graph",
  "generated_at": "2026-06-25T10:19:35Z",
  "repository_commit": "f95b4fe91f273f7a6745f2f7d1de4733757db2dd",
  "provenance": {
    "artifact_id": "ART-GRAPH-00001",
    "produced_by": "Phase0_Discovery",
    "consumes": [
      "docs/discovery/file_inventory.json",
      "docs/discovery/doctype_inventory.json",
      "docs/discovery/field_inventory.json",
      "docs/discovery/api_inventory.json",
      "docs/discovery/business_dictionary.json",
      "docs/discovery/screen_inventory.json",
      "docs/discovery/search_index.json"
    ],
    "used_by": [
      "docs_renderers",
      "quality_gates"
    ]
  },
  "data": {
    "nodes": [
      {
        "id": "ART-DOCTYPE-00001",
        "type": "DOCTYPE",
        "label": "PSV Channel Partner"
      },
      {
        "id": "ART-DOCTYPE-00002",
        "type": "DOCTYPE",
        "label": "PSV Channel Partner Brand"
      },
      {
        "id": "ART-DOCTYPE-00003",
        "type": "DOCTYPE",
        "label": "PSV Ledger Entry"
      },
      {
        "id": "ART-DOCTYPE-00004",
        "type": "DOCTYPE",
        "label": "PSV Reorder Rule"
      },
      {
        "id": "ART-DOCTYPE-00005",
        "type": "DOCTYPE",
        "label": "PSV Stock Aging Snapshot"
      },
      {
        "id": "ART-DOCTYPE-00006",
        "type": "DOCTYPE",
        "label": "PSV System Settings"
      },
      {
        "id": "ART-DOCTYPE-00007",
        "type": "DOCTYPE",
        "label": "SMRITI Address Audit Log"
      },
      {
        "id": "ART-DOCTYPE-00008",
        "type": "DOCTYPE",
        "label": "SMRITI Attribution Event"
      },
      {
        "id": "ART-DOCTYPE-00009",
        "type": "DOCTYPE",
        "label": "SMRITI Attribution Ledger"
      },
      {
        "id": "ART-DOCTYPE-00010",
        "type": "DOCTYPE",
        "label": "SMRITI Attribution Rule"
      },
      {
        "id": "ART-DOCTYPE-00011",
        "type": "DOCTYPE",
        "label": "SMRITI Benefit Audit Log"
      },
      {
        "id": "ART-DOCTYPE-00012",
        "type": "DOCTYPE",
        "label": "SMRITI Benefit Instrument"
      },
      {
        "id": "ART-DOCTYPE-00013",
        "type": "DOCTYPE",
        "label": "SMRITI Benefit Instrument Type"
      },
      {
        "id": "ART-DOCTYPE-00014",
        "type": "DOCTYPE",
        "label": "SMRITI Benefit Ledger"
      },
      {
        "id": "ART-DOCTYPE-00015",
        "type": "DOCTYPE",
        "label": "SMRITI Benefit Liability Snapshot"
      },
      {
        "id": "ART-DOCTYPE-00016",
        "type": "DOCTYPE",
        "label": "SMRITI Benefit Resolution Policy"
      },
      {
        "id": "ART-DOCTYPE-00017",
        "type": "DOCTYPE",
        "label": "SMRITI Benefit Resolution Sequence Detail"
      },
      {
        "id": "ART-DOCTYPE-00018",
        "type": "DOCTYPE",
        "label": "SMRITI Benefit Wallet"
      },
      {
        "id": "ART-DOCTYPE-00019",
        "type": "DOCTYPE",
        "label": "SMRITI Business Term"
      },
      {
        "id": "ART-DOCTYPE-00020",
        "type": "DOCTYPE",
        "label": "SMRITI Campaign"
      },
      {
        "id": "ART-DOCTYPE-00021",
        "type": "DOCTYPE",
        "label": "SMRITI Certification Exam"
      },
      {
        "id": "ART-DOCTYPE-00022",
        "type": "DOCTYPE",
        "label": "SMRITI CGE Settings"
      },
      {
        "id": "ART-DOCTYPE-00023",
        "type": "DOCTYPE",
        "label": "SMRITI Clienteling Settings"
      },
      {
        "id": "ART-DOCTYPE-00024",
        "type": "DOCTYPE",
        "label": "SMRITI Commission Adjustment Detail"
      },
      {
        "id": "ART-DOCTYPE-00025",
        "type": "DOCTYPE",
        "label": "SMRITI Commission Event"
      },
      {
        "id": "ART-DOCTYPE-00026",
        "type": "DOCTYPE",
        "label": "SMRITI Commission Ledger"
      },
      {
        "id": "ART-DOCTYPE-00027",
        "type": "DOCTYPE",
        "label": "SMRITI Commission Rule"
      },
      {
        "id": "ART-DOCTYPE-00028",
        "type": "DOCTYPE",
        "label": "SMRITI Commission Settings"
      },
      {
        "id": "ART-DOCTYPE-00029",
        "type": "DOCTYPE",
        "label": "SMRITI Commission Settlement"
      },
      {
        "id": "ART-DOCTYPE-00030",
        "type": "DOCTYPE",
        "label": "SMRITI Company Settings"
      },
      {
        "id": "ART-DOCTYPE-00031",
        "type": "DOCTYPE",
        "label": "SMRITI Coupon Campaign"
      },
      {
        "id": "ART-DOCTYPE-00032",
        "type": "DOCTYPE",
        "label": "SMRITI Coupon Rule"
      },
      {
        "id": "ART-DOCTYPE-00033",
        "type": "DOCTYPE",
        "label": "SMRITI Customer Benefit Profile"
      },
      {
        "id": "ART-DOCTYPE-00034",
        "type": "DOCTYPE",
        "label": "SMRITI Customer Graph"
      },
      {
        "id": "ART-DOCTYPE-00035",
        "type": "DOCTYPE",
        "label": "SMRITI Customer Intelligence Graph"
      },
      {
        "id": "ART-DOCTYPE-00036",
        "type": "DOCTYPE",
        "label": "SMRITI Customer Interaction"
      },
      {
        "id": "ART-DOCTYPE-00037",
        "type": "DOCTYPE",
        "label": "SMRITI Customer Ownership"
      },
      {
        "id": "ART-DOCTYPE-00038",
        "type": "DOCTYPE",
        "label": "SMRITI Customer Profile"
      },
      {
        "id": "ART-DOCTYPE-00039",
        "type": "DOCTYPE",
        "label": "SMRITI Custom Attribute"
      },
      {
        "id": "ART-DOCTYPE-00040",
        "type": "DOCTYPE",
        "label": "SMRITI Entity Attribute Value"
      },
      {
        "id": "ART-DOCTYPE-00041",
        "type": "DOCTYPE",
        "label": "SMRITI Explain Audit Event"
      },
      {
        "id": "ART-DOCTYPE-00042",
        "type": "DOCTYPE",
        "label": "SMRITI Formula Definition"
      },
      {
        "id": "ART-DOCTYPE-00043",
        "type": "DOCTYPE",
        "label": "SMRITI Gender"
      },
      {
        "id": "ART-DOCTYPE-00044",
        "type": "DOCTYPE",
        "label": "SMRITI Heel Type"
      },
      {
        "id": "ART-DOCTYPE-00045",
        "type": "DOCTYPE",
        "label": "SMRITI Key Custodian"
      },
      {
        "id": "ART-DOCTYPE-00046",
        "type": "DOCTYPE",
        "label": "SMRITI Knowledge Asset"
      },
      {
        "id": "ART-DOCTYPE-00047",
        "type": "DOCTYPE",
        "label": "SMRITI Knowledge Relation"
      },
      {
        "id": "ART-DOCTYPE-00048",
        "type": "DOCTYPE",
        "label": "SMRITI Liability Snapshot"
      },
      {
        "id": "ART-DOCTYPE-00049",
        "type": "DOCTYPE",
        "label": "SMRITI License"
      },
      {
        "id": "ART-DOCTYPE-00050",
        "type": "DOCTYPE",
        "label": "SMRITI License Activity Log"
      },
      {
        "id": "ART-DOCTYPE-00051",
        "type": "DOCTYPE",
        "label": "SMRITI License Features"
      },
      {
        "id": "ART-DOCTYPE-00052",
        "type": "DOCTYPE",
        "label": "SMRITI License Validation History"
      },
      {
        "id": "ART-DOCTYPE-00053",
        "type": "DOCTYPE",
        "label": "SMRITI Loyalty Program"
      },
      {
        "id": "ART-DOCTYPE-00054",
        "type": "DOCTYPE",
        "label": "SMRITI Loyalty Rule"
      },
      {
        "id": "ART-DOCTYPE-00055",
        "type": "DOCTYPE",
        "label": "SMRITI Loyalty Tier"
      },
      {
        "id": "ART-DOCTYPE-00056",
        "type": "DOCTYPE",
        "label": "SMRITI Membership Tier"
      },
      {
        "id": "ART-DOCTYPE-00057",
        "type": "DOCTYPE",
        "label": "SMRITI Merchandise Category"
      },
      {
        "id": "ART-DOCTYPE-00058",
        "type": "DOCTYPE",
        "label": "SMRITI Outsole"
      },
      {
        "id": "ART-DOCTYPE-00059",
        "type": "DOCTYPE",
        "label": "SMRITI Party Physical Item"
      },
      {
        "id": "ART-DOCTYPE-00060",
        "type": "DOCTYPE",
        "label": "SMRITI Party Physical Snapshot"
      },
      {
        "id": "ART-DOCTYPE-00061",
        "type": "DOCTYPE",
        "label": "SMRITI Party Sales Item"
      },
      {
        "id": "ART-DOCTYPE-00062",
        "type": "DOCTYPE",
        "label": "SMRITI Party Sales Upload"
      },
      {
        "id": "ART-DOCTYPE-00063",
        "type": "DOCTYPE",
        "label": "SMRITI Party Stock Account"
      },
      {
        "id": "ART-DOCTYPE-00064",
        "type": "DOCTYPE",
        "label": "SMRITI Party Stock Ledger Entry"
      },
      {
        "id": "ART-DOCTYPE-00065",
        "type": "DOCTYPE",
        "label": "SMRITI Print Job"
      },
      {
        "id": "ART-DOCTYPE-00066",
        "type": "DOCTYPE",
        "label": "SMRITI Print Template"
      },
      {
        "id": "ART-DOCTYPE-00067",
        "type": "DOCTYPE",
        "label": "SMRITI Print Template Version"
      },
      {
        "id": "ART-DOCTYPE-00068",
        "type": "DOCTYPE",
        "label": "SMRITI Promotion Rule"
      },
      {
        "id": "ART-DOCTYPE-00069",
        "type": "DOCTYPE",
        "label": "SMRITI Provision Log"
      },
      {
        "id": "ART-DOCTYPE-00070",
        "type": "DOCTYPE",
        "label": "SMRITI PSV Activity Log"
      },
      {
        "id": "ART-DOCTYPE-00071",
        "type": "DOCTYPE",
        "label": "SMRITI PSV Exam Attempt"
      },
      {
        "id": "ART-DOCTYPE-00072",
        "type": "DOCTYPE",
        "label": "SMRITI PSV Exception Record"
      },
      {
        "id": "ART-DOCTYPE-00073",
        "type": "DOCTYPE",
        "label": "SMRITI PSV Reorder Rule"
      },
      {
        "id": "ART-DOCTYPE-00074",
        "type": "DOCTYPE",
        "label": "SMRITI PSV Settings"
      },
      {
        "id": "ART-DOCTYPE-00075",
        "type": "DOCTYPE",
        "label": "SMRITI PSV Transaction"
      },
      {
        "id": "ART-DOCTYPE-00076",